Video,About,Age,Link
8 Common Early Signs of Autism,psychologist talks about early signs of asd,toddlers,https://www.youtube.com/watch?v=GJEqIZbv87Y
Early signs of autism studied in infants,signs of asd in infants,infants,https://www.youtube.com/watch?v=wIoUX5s26WM
"Autism Misdiagnosis - Can a Child Have Autism Symptoms, But Not Be Autistic?","is it possible you are missreading signs of asd in your child, and what are the other diagnosis",Children,https://www.youtube.com/watch?v=LXm3wUoRJho
What are the signs of autism and how does it affect the child?,"Diagnosis process, signs, different spectrums, definition",Children,https://www.youtube.com/watch?v=PGwBWMN4-Po
Autism Spectrum: Atypical Minds in a Stereotypical World,How kids w/ asd interact w/ the world,Children,https://www.youtube.com/watch?v=j3PrAqJ-H9k
Autism spectrum disorder assessment,What to expect during an asd assesment,Children,Autism spectrum disorder assessment - YouTube
Autism Spectrum Disorder: 10 things you should know,Common signs of asd in children,Children,https://www.youtube.com/watch?v=DZXjJVrm1Jw
Rogers Behavioral Health therapist provides tips to support children with autism spectrum disorder,How to support children w/ asd,children,https://www.youtube.com/watch?v=qb8n9g9ruL8
Children with Autism Spectrum Disorder: Playing with Toys,Licence doctor talks about differences in behavior when playing w/ toys,children,https://www.youtube.com/watch?v=ONQP1Qb51pw
"Autism Spectrum Disorder - Overview, Causes, Symptoms & Treatment","causes, symptoms and treatments of asd",adults,https://www.youtube.com/watch?v=Bgyq5cTiHto
Autism spectrum disorder: Mayo Clinic Radio,general overview of asd from mayo clinic,adults,https://www.youtube.com/watch?v=hl0R7tDWLrc
Autism Spectrum Disorder: ASD,general overview of asd including signs ,adults,https://www.youtube.com/watch?v=r29iOjnbbgA
